{
  "$schema": "http://json-schema.org/draft-07/schema#",
  "title": "Client",
  "description": "A client organization with contacts",
  "type": "object",
  "required": ["name"],
  "properties": {
    "id": { "type": "string" },
    "name": { "type": "string" },
    "address1": { "type": "string" },
    "city": { "type": "string" },
    "state": { "type": "string" },
    "postal_code": { "type": "string" },
    "country": { "type": "string" },
    "phone": { "type": "string" },
    "payment_terms": {
      "type": "integer",
      "description": "Net days, overrides company default"
    },
    "contacts": {
      "type": "array",
      "items": {
        "type": "object",
        "required": ["first_name", "last_name", "email"],
        "properties": {
          "id": { "type": "string" },
          "first_name": { "type": "string" },
          "last_name": { "type": "string" },
          "email": { "type": "string", "format": "email" },
          "phone": { "type": "string" },
          "is_primary": { "type": "boolean", "default": false },
          "send_invoices": { "type": "boolean", "default": false }
        }
      }
    }
  }
}
